question_id,requirement_code,requirement_name,requirement_type,question_text,evidence_required,tags
Q-367,CERTIFICATION MAINTENANCE,,Appendix,Is SERI licensing current?,License acknowledgment,
Q-368,CERTIFICATION MAINTENANCE,,Appendix,Are CB communications timely?,Communication records,
Q-369,CERTIFICATION MAINTENANCE,,Appendix,Are nonconformity deadlines met?,Table 6 compliance,
Q-370,CERTIFICATION MAINTENANCE,,Appendix,Are major NCs properly managed?,Major NC resolution,
Q-371,FINAL VERIFICATION,,Appendix,Can the facility demonstrate overall R2 compliance?,Comprehensive compliance evidence,
Q-372,FINAL VERIFICATION,,Appendix,Are all applicable appendices properly implemented?,Appendix implementation verification,
Q-373,FINAL VERIFICATION,,Appendix,Is the management system effectively integrated?,System integration evidence,
Q-374,FINAL VERIFICATION,,Appendix,Are resources adequate for compliance?,Resource adequacy assessment,
Q-375,FINAL VERIFICATION,,Appendix,Is top management committed to R2?,Management commitment evidence,
Q-376,FINAL VERIFICATION,,Appendix,Are roles and responsibilities clearly defined?,Organizational chart and descriptions,
Q-377,FINAL VERIFICATION,,Appendix,Is documentation control effective?,Document control system,
Q-378,FINAL VERIFICATION,,Appendix,Are records properly maintained?,Records management system,
Q-379,FINAL VERIFICATION,,Appendix,Is the facility prepared for unannounced inspections?,Inspection readiness,
Q-380,FINAL VERIFICATION,,Appendix,Are all R2 requirements demonstrably met?,Complete conformance portfolio,
Q-381,REMOTE AUDIT SPECIFIC (WHERE APPLICABLE),,Appendix,Are remote audit prerequisites met?,Phase 1 qualification checklist,
Q-382,REMOTE AUDIT SPECIFIC (WHERE APPLICABLE),,Appendix,Is documentation uploaded timely?,10-day advance upload,
Q-383,REMOTE AUDIT SPECIFIC (WHERE APPLICABLE),,Appendix,Are video capabilities adequate?,Video tour capability,
Q-384,REMOTE AUDIT SPECIFIC (WHERE APPLICABLE),,Appendix,Is file sharing secure and functional?,Secure platform access,
Q-385,REMOTE AUDIT SPECIFIC (WHERE APPLICABLE),,Appendix,Are all areas accessible virtually?,Complete facility coverage,
Q-386,REMOTE AUDIT SPECIFIC (WHERE APPLICABLE),,Appendix,Are workers available for interviews?,Interview scheduling,
Q-387,REMOTE AUDIT SPECIFIC (WHERE APPLICABLE),,Appendix,Can operations be observed live?,Active operations verification,
Q-388,REMOTE AUDIT SPECIFIC (WHERE APPLICABLE),,Appendix,Are connectivity issues resolved?,Stable connection verification,
Q-389,REMOTE AUDIT SPECIFIC (WHERE APPLICABLE),,Appendix,Is documentation in auditor's language?,Translation if needed,
Q-390,REMOTE AUDIT SPECIFIC (WHERE APPLICABLE),,Appendix,Are follow-up requirements understood?,Phase 5 completion,
Q-391,CONTINUOUS IMPROVEMENT,,Appendix,Are lessons learned captured?,Improvement tracking system,
Q-392,CONTINUOUS IMPROVEMENT,,Appendix,Are best practices shared?,Knowledge sharing records,
Q-393,CONTINUOUS IMPROVEMENT,,Appendix,Are efficiency improvements tracked?,Efficiency metrics,
Q-394,CONTINUOUS IMPROVEMENT,,Appendix,Are cost reductions documented?,Cost benefit analysis,
Q-395,CONTINUOUS IMPROVEMENT,,Appendix,Are innovation initiatives supported?,Innovation program evidence,
Q-396,CONTINUOUS IMPROVEMENT,,Appendix,Are employee suggestions implemented?,Suggestion program records,
Q-397,CONTINUOUS IMPROVEMENT,,Appendix,Are benchmarking activities performed?,Benchmark comparisons,
Q-398,CONTINUOUS IMPROVEMENT,,Appendix,Are industry trends monitored?,Trend analysis records,
Q-399,CONTINUOUS IMPROVEMENT,,Appendix,Are technology upgrades evaluated?,Technology assessment,
Q-400,CONTINUOUS IMPROVEMENT,,Appendix,Is overall performance improving?,Performance trend data,
